{
  "provenance": {
    "authored": "hand",
    "generator": null,
    "source": "fixture"
  },
  "frozen": false,
  "interior": {
    "units": "km",
    "perParentUnit": 1
  },
  "interstitial": null,
  "interstitialUnsurveyed": false,
  "compositionTolerance": null,
  "toleranceWhy": null,
  "features": [],
  "bands": [],
  "runtime": {
    "mapIds": [],
    "originU": null,
    "spawnAreas": [],
    "mobSettings": null,
    "seedDemoNPCs": false,
    "collision": "none"
  },
  "representsNodeId": null,
  "lore": {},
  "tags": [],
  "levelBand": null,
  "id": "n-c",
  "tier": "fixture",
  "parentId": "n-w",
  "title": "n-c",
  "seed": {
    "value": "e5f1a00000000003",
    "epoch": 0,
    "why": null
  },
  "placement": {
    "shape": "rect",
    "rect": {
      "x": 0,
      "y": 0,
      "w": 8,
      "h": 8
    },
    "anchor": [
      4,
      4
    ]
  },
  "composition": {
    "built": 100
  }
}
