{
  "id": "n-drowned-pavement",
  "tier": "sea",
  "parentId": "n-keelbreak",
  "title": "Drowned Pavement",
  "provenance": {
    "authored": "generated",
    "generator": {
      "name": "mapforge",
      "version": "3.0.0",
      "fabric": "content/world/fabric/world.json"
    },
    "source": "content/world/manifest.json"
  },
  "frozen": false,
  "seed": {
    "value": "4754e5fcfa91ed61",
    "epoch": 0,
    "why": null
  },
  "placement": {
    "shape": "polygon",
    "points": [
      [318.5, 337],
      [301, 319],
      [308, 319],
      [308, 318.5],
      [311, 318.5],
      [311, 318],
      [317.5, 317.5],
      [317.5, 317],
      [323.5, 316],
      [323.5, 315.5],
      [327, 315],
      [327, 314.5],
      [328.5, 314.5],
      [328.5, 314],
      [329.5, 314],
      [329.5, 313.5],
      [331, 313.5],
      [331, 313],
      [332, 313],
      [332.5, 312],
      [333.5, 312],
      [333.5, 311.5],
      [334.5, 311.5],
      [335, 310.5],
      [336, 310.5],
      [336, 310],
      [337, 310],
      [337.5, 309],
      [338.5, 309],
      [340, 307],
      [341, 307],
      [341, 306.5],
      [354, 294],
      [354, 293],
      [355.5, 292],
      [355.5, 291],
      [356.5, 290.5],
      [356.5, 289.5],
      [357, 289.5],
      [357.5, 288],
      [358.5, 287.5],
      [358.5, 286.5],
      [359, 286.5],
      [359, 285.5],
      [359.5, 285.5],
      [359.5, 284],
      [360, 284],
      [360, 283],
      [360.5, 283],
      [360.5, 282],
      [361, 282],
      [361, 281],
      [361.5, 281],
      [361.5, 280],
      [362, 280],
      [362, 279],
      [362.5, 279],
      [362.5, 278],
      [363, 278],
      [363, 277],
      [363.5, 277],
      [363.5, 275.5],
      [364, 275.5],
      [364, 274],
      [364.5, 274],
      [364.5, 271.5],
      [365, 271.5],
      [365, 270.5],
      [365.5, 270.5],
      [365.5, 269],
      [366, 269],
      [366, 268],
      [366.5, 268],
      [366.5, 267],
      [367, 267],
      [367, 265.5],
      [367.5, 265.5],
      [367.5, 264],
      [368, 264],
      [368, 262.5],
      [368.5, 262.5],
      [368.5, 259.5],
      [369, 259.5],
      [369.5, 255.5],
      [370, 255.5],
      [370, 249],
      [370.5, 249],
      [370.5, 249.5],
      [392, 270.5],
      [392, 370],
      [391.5, 370],
      [386.5, 375.5],
      [385.5, 375.5],
      [385.5, 376],
      [384, 377],
      [383.5, 376],
      [382.5, 376],
      [382.5, 375.5],
      [368.5, 362],
      [384, 346],
      [371.5, 334],
      [371.5, 333],
      [347, 309],
      [347, 308.5],
      [322, 333],
      [322, 334],
      [319, 336.5],
      [319, 337]
    ],
    "anchor": [367.75, 304.25]
  },
  "interior": {
    "units": "km",
    "perParentUnit": 1,
    "size": [91, 128],
    "originInParent": [301, 249]
  },
  "composition": {
    "ocean": 100
  },
  "interstitial": null,
  "interstitialUnsurveyed": false,
  "compositionTolerance": null,
  "toleranceWhy": null,
  "terrainKind": null,
  "features": [],
  "bands": [],
  "runtime": null,
  "representsNodeId": null,
  "lore": {
    "summary": null
  },
  "tags": [],
  "levelBand": null
}
