{
  "id": "n-netstead-bight",
  "tier": "sea",
  "parentId": "n-keelbreak",
  "title": "Netstead Bight",
  "provenance": {
    "authored": "generated",
    "generator": {
      "name": "mapforge",
      "version": "3.0.0",
      "fabric": "content/world/fabric/world.json"
    },
    "source": "content/world/manifest.json"
  },
  "frozen": false,
  "seed": {
    "value": "e9048ebeeafff0c9",
    "epoch": 0,
    "why": null
  },
  "placement": {
    "shape": "polygon",
    "points": [
      [342.5, 379.5],
      [330, 391.5],
      [330, 392],
      [314.5, 392],
      [290, 367],
      [289.5, 367],
      [289.5, 366.5],
      [289, 366.5],
      [289, 366],
      [288.5, 366],
      [288.5, 365.5],
      [288, 365.5],
      [288, 365],
      [287.5, 365],
      [287.5, 364.5],
      [287, 364.5],
      [287, 364],
      [286.5, 364],
      [286.5, 363.5],
      [286, 363.5],
      [286, 362.5],
      [291.5, 357.5],
      [291.5, 356.5],
      [292.5, 356],
      [292.5, 355],
      [293.5, 354.5],
      [294.5, 351.5],
      [295, 351.5],
      [295, 350],
      [295.5, 350],
      [296, 345],
      [302.5, 339],
      [302.5, 338],
      [309, 332],
      [309, 331.5],
      [315.5, 337.5],
      [316, 339],
      [316.5, 339],
      [309.5, 346.5],
      [310, 346.5],
      [310, 347],
      [310.5, 347],
      [310.5, 347.5],
      [311, 347.5],
      [311, 348],
      [311.5, 348],
      [311.5, 348.5],
      [312, 348.5],
      [312, 349],
      [312.5, 349],
      [312.5, 349.5],
      [313, 349.5],
      [313, 350],
      [313.5, 350],
      [313.5, 350.5],
      [314, 350.5],
      [314, 351],
      [314.5, 351],
      [314.5, 351.5],
      [315, 351.5],
      [315, 352],
      [315.5, 352],
      [315.5, 352.5],
      [316, 352.5],
      [316, 353],
      [316.5, 353],
      [316.5, 353.5],
      [317, 353.5],
      [317, 354],
      [317.5, 354],
      [317.5, 354.5],
      [318, 354.5]
    ],
    "anchor": [306.25, 363.25]
  },
  "interior": {
    "units": "km",
    "perParentUnit": 1,
    "size": [56.5, 60.5],
    "originInParent": [286, 331.5]
  },
  "composition": {
    "ocean": 100
  },
  "interstitial": null,
  "interstitialUnsurveyed": false,
  "compositionTolerance": null,
  "toleranceWhy": null,
  "terrainKind": null,
  "features": [],
  "bands": [],
  "runtime": null,
  "representsNodeId": null,
  "lore": {
    "summary": null
  },
  "tags": [],
  "levelBand": null
}
