{
  "id": "n-rimewall-margin",
  "tier": "sea",
  "parentId": "n-tarnmark",
  "title": "Rimewall Margin",
  "provenance": {
    "authored": "generated",
    "generator": {
      "name": "mapforge",
      "version": "3.0.0",
      "fabric": "content/world/fabric/world.json"
    },
    "source": "content/world/manifest.json"
  },
  "frozen": false,
  "seed": {
    "value": "621415c9dcf1b1bf",
    "epoch": 0,
    "why": null
  },
  "placement": {
    "shape": "polygon",
    "points": [
      [350.5, 12.5],
      [330, 33.5],
      [329.5, 33.5],
      [335, 39.5],
      [332, 40],
      [332, 40.5],
      [331, 40.5],
      [331, 41],
      [328, 42],
      [318.5, 52],
      [316.5, 51.5],
      [316.5, 51],
      [315, 50.5],
      [314.5, 49.5],
      [313.5, 49.5],
      [313.5, 49],
      [312.5, 49],
      [312.5, 48.5],
      [311.5, 48.5],
      [311.5, 48],
      [310.5, 48],
      [310.5, 47.5],
      [309.5, 47.5],
      [309.5, 47],
      [308.5, 47],
      [308.5, 46.5],
      [307.5, 46.5],
      [307.5, 46],
      [306, 46],
      [306, 45.5],
      [304.5, 45.5],
      [304.5, 45],
      [303, 45],
      [303, 44.5],
      [301.5, 44.5],
      [301.5, 44],
      [300, 44],
      [300, 43.5],
      [294, 42.5],
      [294, 42],
      [292.5, 42],
      [292.5, 41.5],
      [292, 41.5],
      [290, 44],
      [289, 44],
      [287.5, 46],
      [286.5, 46],
      [285.5, 47.5],
      [284, 48],
      [284, 47.5],
      [283, 47],
      [283, 46],
      [287, 42.5],
      [287, 41.5],
      [287.5, 41.5],
      [287.5, 40.5],
      [288, 40.5],
      [287.5, 35.5],
      [291, 32.5],
      [291, 31],
      [290.5, 31],
      [290.5, 30],
      [289.5, 29.5],
      [289.5, 28.5],
      [289, 28.5],
      [279, 18],
      [278, 18],
      [278, 17.5],
      [286.5, 9.5],
      [287, 8],
      [346.5, 8],
      [346.5, 9]
    ],
    "anchor": [313.75, 28.75]
  },
  "interior": {
    "units": "km",
    "perParentUnit": 1,
    "size": [72.5, 44],
    "originInParent": [278, 8]
  },
  "composition": {
    "ocean": 100
  },
  "interstitial": null,
  "interstitialUnsurveyed": false,
  "compositionTolerance": null,
  "toleranceWhy": null,
  "terrainKind": null,
  "features": [],
  "bands": [],
  "runtime": null,
  "representsNodeId": null,
  "lore": {
    "summary": null
  },
  "tags": [],
  "levelBand": null
}
