{
  "id": "n-millcross",
  "tier": "town",
  "parentId": "n-millcross-ford",
  "title": "Millcross",
  "provenance": {
    "authored": "hand",
    "generator": null,
    "source": "content/maps/cluster1-geography.json"
  },
  "frozen": true,
  "absoluteAnchor": [86, 118],
  "seed": {
    "value": "dbcf5119861b0417",
    "epoch": 0,
    "why": null
  },
  "placement": {
    "shape": "rect",
    "rect": {
      "x": 84.9,
      "y": 117.2,
      "w": 2.2,
      "h": 1.6
    },
    "anchor": [86, 118]
  },
  "interior": {
    "units": "u",
    "perParentUnit": 100,
    "size": [220, 160],
    "originInParent": [84.9, 117.2],
    "anchorInInterior": [110, 80]
  },
  "composition": {
    "meadow": 63,
    "built": 28,
    "river": 9
  },
  "interstitial": null,
  "interstitialUnsurveyed": false,
  "compositionTolerance": null,
  "toleranceWhy": null,
  "features": [],
  "bands": [],
  "runtime": {
    "mapIds": [],
    "originU": null,
    "spawnAreas": [],
    "mobSettings": null,
    "seedDemoNPCs": false,
    "collision": "none"
  },
  "representsNodeId": null,
  "lore": {
    "order": 1,
    "emblem": "crossed roads over an empty bowl",
    "reason": "The only cart-crossing of the river that splits the land, and the fork of the north road",
    "labelAnchor": "east"
  },
  "tags": [],
  "levelBand": null
}
